<?xml version="1.0" encoding="UTF-8"?><!-- edited with XMLSPY v2004 rel. 3 U (http://www.xmlspy.com) by Matthias (paprosoft) --><xs:schema xmlns:xs="http://www.w3.org/2001/XMLSchema" elementFormDefault="qualified" attributeFormDefault="unqualified">	<xs:element name="modul">		<xs:annotation>			<xs:documentation>encapsulates a modul</xs:documentation>		</xs:annotation>		<xs:complexType>			<xs:sequence>				<xs:element name="input" minOccurs="0">					<xs:complexType>						<xs:sequence minOccurs="0" maxOccurs="unbounded">							<xs:element ref="vardef" minOccurs="0" maxOccurs="unbounded"/>						</xs:sequence>					</xs:complexType>				</xs:element>				<xs:element name="output" minOccurs="0">					<xs:complexType>						<xs:sequence minOccurs="0" maxOccurs="unbounded">							<xs:element ref="vardef" minOccurs="0" maxOccurs="unbounded"/>						</xs:sequence>					</xs:complexType>				</xs:element>				<xs:element name="global" minOccurs="0">					<xs:complexType>						<xs:sequence minOccurs="0">							<xs:element name="def" minOccurs="0" maxOccurs="unbounded">								<xs:complexType>									<xs:simpleContent>										<xs:extension base="xs:string">											<xs:attribute name="description" type="xs:string" use="optional"/>										</xs:extension>									</xs:simpleContent>								</xs:complexType>							</xs:element>						</xs:sequence>					</xs:complexType>				</xs:element>				<xs:element ref="opcode" minOccurs="0"/>			</xs:sequence>			<xs:attribute name="file" type="xs:string" use="optional"/>			<xs:attribute ref="name" type="xs:string" use="required"/>			<xs:attribute ref="widget" use="optional"/>			<xs:attribute ref="description" use="required"/>			<xs:attribute name="skin" type="xs:string" use="optional"/>		</xs:complexType>	</xs:element>	<xs:element name="input">		<xs:annotation>			<xs:documentation>encapsulates all input params</xs:documentation>		</xs:annotation>		<xs:complexType>			<xs:sequence minOccurs="0" maxOccurs="unbounded">				<xs:element ref="varref" minOccurs="0" maxOccurs="unbounded"/>			</xs:sequence>		</xs:complexType>	</xs:element>	<xs:element name="output">		<xs:annotation>			<xs:documentation>encapsulates all out parameters</xs:documentation>		</xs:annotation>		<xs:complexType>			<xs:choice>				<xs:element name="vardef" minOccurs="0">					<xs:complexType>						<xs:attribute name="name" type="xs:ID" use="required"/>						<xs:attribute name="csType" use="optional">							<xs:simpleType>								<xs:restriction base="xs:string">									<xs:enumeration value="i"/>									<xs:enumeration value="a"/>									<xs:enumeration value="k"/>									<xs:enumeration value="gi"/>									<xs:enumeration value="ga"/>									<xs:enumeration value="gk"/>									<xs:enumeration value="p"/>									<xs:enumeration value="v"/>									<xs:enumeration value="w"/>									<xs:enumeration value="c"/>									<xs:enumeration value="f"/>									<xs:enumeration value="gv"/>									<xs:enumeration value="fa"/>									<xs:enumeration value="reserved_symbol"/>								</xs:restriction>							</xs:simpleType>						</xs:attribute>						<xs:attribute name="description" type="xs:string" use="optional"/>					</xs:complexType>				</xs:element>				<xs:element ref="varref" minOccurs="0"/>			</xs:choice>		</xs:complexType>	</xs:element>	<xs:element name="opcode">		<xs:annotation>			<xs:documentation>calls a CSound "function"</xs:documentation>		</xs:annotation>		<xs:complexType>			<xs:simpleContent>				<xs:extension base="xs:string"/>			</xs:simpleContent>		</xs:complexType>	</xs:element>	<xs:element name="vardef">		<xs:annotation>			<xs:documentation>defines a var</xs:documentation>		</xs:annotation>		<xs:complexType>			<xs:attribute ref="name" use="required"/>			<xs:attribute name="widget" use="optional">				<xs:simpleType>					<xs:restriction base="xs:string">						<xs:enumeration value="defSlider"/>					</xs:restriction>				</xs:simpleType>			</xs:attribute>			<xs:attribute name="scoParam" type="xs:int" use="optional"/>			<xs:attribute name="value" type="xs:string" use="optional"/>			<xs:attribute name="min" type="xs:integer" use="optional"/>			<xs:attribute name="max" type="xs:integer" use="optional"/>			<xs:attribute ref="description" use="optional"/>			<xs:attribute name="isModulPort" type="xs:boolean" use="optional" default="1"/>			<xs:attribute name="csType" use="required">				<xs:simpleType>					<xs:restriction base="xs:string">						<xs:enumeration value="i"/>						<xs:enumeration value="a"/>						<xs:enumeration value="k"/>						<xs:enumeration value="gi"/>						<xs:enumeration value="ga"/>						<xs:enumeration value="gk"/>						<xs:enumeration value="p"/>						<xs:enumeration value="v"/>						<xs:enumeration value="w"/>						<xs:enumeration value="c"/>						<xs:enumeration value="f"/>						<xs:enumeration value="gv"/>						<xs:enumeration value="fa"/>						<xs:enumeration value="reserved_symbol"/>					</xs:restriction>				</xs:simpleType>			</xs:attribute>		</xs:complexType>	</xs:element>	<xs:element name="varref">		<xs:annotation>			<xs:documentation>references a var</xs:documentation>		</xs:annotation>		<xs:complexType>			<xs:attribute name="ref" type="xs:IDREF" use="required"/>		</xs:complexType>	</xs:element>	<xs:attribute name="widget">		<xs:annotation>			<xs:documentation>defines the widget to use for the graphical representation of the i/o params</xs:documentation>		</xs:annotation>		<xs:simpleType>			<xs:restriction base="xs:string">				<xs:enumeration value="defSlidebars"/>				<xs:enumeration value="defModulBox"/>			</xs:restriction>		</xs:simpleType>	</xs:attribute>	<xs:attribute name="name" type="xs:ID">		<xs:annotation>			<xs:documentation>unique name</xs:documentation>		</xs:annotation>	</xs:attribute>	<xs:attribute name="description" type="xs:string">		<xs:annotation>			<xs:documentation>describes the modul, var, or what it should describe.oh my god</xs:documentation>		</xs:annotation>	</xs:attribute>	<xs:attribute name="moduleID" type="xs:string">		<xs:annotation>			<xs:documentation>reference to the module to which the node belongs</xs:documentation>		</xs:annotation>	</xs:attribute></xs:schema>