<?xml version="1.0" encoding="UTF-8"?><modul xmlns:xsi="http://www.w3.org/2001/XMLSchema-instance" xsi:noNamespaceSchemaLocation="modul.xsd" name="AdsrLinTrigger" description="Triggered linear ADSR envelope">  <input>    <vardef name="trigger" csType="k" value="1" min="0" max="1" digits="0" description="Trigger or clock signal"/>    <vardef name="amp" csType="i" value="1" description="Amplitude scale factor"/>    <vardef name="atk" csType="i" value="0.01" min="0" max="1000" description="Attack time in seconds"/>    <vardef name="dec" csType="i" min="0" max="1000" description="Decay time in seconds"/>    <vardef name="slev" csType="i" value="1" min="0" max="1" description="Sustain level"/>    <vardef name="stime" csType="i" min="0" max="1000" description="Sustain time in seconds"/>    <vardef name="rel" csType="i" value="0.01" min="0" max="1000" description="Release time in seconds"/>  </input>  <output>    <vardef name="env" csType="k" description="Envelope control signal"/>  </output>  <opcode>/* Triggered linear ADSR envelope */opcode AdsrLinTrigger, k, kiiiiii  ktrigger, iamp, iatk, idec, islev, istime, irel xin    ktrigger limit ktrigger, 0, 1  klasttrigger init 0  if (klasttrigger == 0 &amp;&amp; ktrigger == 1) then    kstart = 1  else    kstart = 0  endif  reset:  if (kstart &lt; 1) goto contin  reinit resetcontin:  kenv linseg 0, iatk, 1, idec, islev, istime, islev, irel, 0  rireturn  kenv = iamp*kenv    klasttrigger = ktrigger      xout kenvendop  </opcode></modul>