<?xml version="1.0" encoding="UTF-8"?><modul xmlns:xsi="http://www.w3.org/2001/XMLSchema-instance" xsi:noNamespaceSchemaLocation="modul.xsd" name="Lfo" description="Low frequency oscilllator with multiple waveform types">  <input>    <vardef name="frq" csType="k" value="1" min="0" max="400" description="Frequency of LFO"/>    <vardef name="amp" csType="k" value="1" min="0" description="Amplitude of LFO"/>    <vardef name="waveform" csType="i" value="0" min="0" max="5" digits="0" description="Output Waveform: 0 sine, 1 trinangle, 2 square (bipolar), 3 square (unipolar), 4 ramp, 5 saw"/>  </input>  <output>    <vardef name="out" csType="k" description="Output of LFO"/>  </output>  <opcode>/* LFO with multiple waveforms */opcode Lfo, k, kki  kfrq, kamp, iwaveform xin  kfrq     limit      kfrq, 0, 100  kamp     limit      kamp, 0, 50000  kout     lfo        kamp, kfrq, iwaveform  xout koutendop  </opcode></modul>