<?xml version="1.0" encoding="UTF-8"?><modul xmlns:xsi="http://www.w3.org/2001/XMLSchema-instance" xsi:noNamespaceSchemaLocation="modul.xsd" name="SineLfo" description="Sine low frequency oscillator">  <input>    <vardef name="frq" csType="k" value="1" min="0" max="100" description="Frequency of LFO"/>    <vardef name="amp" csType="k" value="1" min="0" description="Amplitude of LFO"/>    <vardef name="phi" csType="i" value="0" min="-0.001" max="1" digits="3" description="Initial phase of LFO (negativ to skip initialisation)"/>  </input>  <output>    <vardef name="out" csType="k" description="Output of LFO"/>  </output>  <global>    <def description="Sine table">gisinelfo   ftgen  0, 0, 2048, 10 ,1</def>  </global>  <opcode>/* Sine low frequency oscillator */opcode SineLfo, k, kki  kfrq, kamp, iphi xin  kfrq     limit      kfrq, 0, 100  kamp     limit      kamp, 0, 50000  iphi     limit      iphi, -1, 1  kout     oscil      kamp, kfrq, gisinelfo, iphi  xout koutendop  </opcode></modul>