<?xml version="1.0" encoding="UTF-8"?>
<modul xmlns:xsi="http://www.w3.org/2001/XMLSchema-instance" xsi:noNamespaceSchemaLocation="modul.xsd" name="MoogVcf2" description="Moog lowpass filter (no self-oscillation)">
  <input>
    <vardef name="in" csType="a" description="Audio rate input"/>
    <vardef name="fco" csType="k" value="2000" min="0" description="Filter cut-off frequency"/>
    <vardef name="res" csType="k" min="0" max="0.85" description="Filter resonance"/>
  </input>
  <output>
    <vardef name="out" csType="a" description="Filtered audio signal"/>
  </output>
  <opcode>/* Moog lowpass filter */
opcode MoogVcf2, a, akk
  ain, kfco, kres  xin

  ain     = ain*0.00003
  ain     limit ain, -1, 1
  kfco    limit kfco, 0, 50000
  kres    limit kres, 0, 0.85
  aout    moogvcf ain, kfco, kres
  aout    = aout*20000

  xout aout
endop
  </opcode>
</modul>
