<?xml version="1.0" encoding="UTF-8"?>
<modul xmlns:xsi="http://www.w3.org/2001/XMLSchema-instance" xsi:noNamespaceSchemaLocation="modul.xsd" name="AnalogEcho" description="Reverb based on the MN3011 IC">
  <input>
    <vardef name="in" csType="a" description="Audio input"/>
    <vardef name="lvl" csType="i" value="1" min="0" max="1" description="Output level"/>
    <vardef name="delay" csType="i" value="0.5" min="0" max="1" description="Delay factor"/>
    <vardef name="fdbk" csType="i" value="0.3" min="0" max="1" description="Feedback amount"/>
    <vardef name="echo" csType="i" value="0.04" min="0" max="1" description="Reverb amount"/>
  </input>
  <output>
    <vardef name="out" csType="a" description="Input with applied echo"/>
  </output>
  <opcode>/* Reverb based on the MN3011 IC */
opcode AnalogEcho, a, aiiii
  ain, ilvl, idelay, ifdbk, iecho  xin

  afdbk     init     0
  ain       =        ain+afdbk*ifdbk
  atemp     delayr   1
  atap1     deltapi  0.0396*idelay
  atap2     deltapi  0.0662*idelay
  atap3     deltapi  0.1194*idelay
  atap4     deltapi  0.1726*idelay
  atap5     deltapi  0.2790*idelay
  atap6     deltapi  0.3328*idelay
            delayw   ain
  afdbk     butterlp atap6, 7000
  abbd      sum      atap1, atap2, atap3, atap4, atap5, atap6
  abbd      butterlp abbd, 7000
  aout      =        (ain+abbd*iecho)*ilvl

  ; stay triggered until echo fades out
  kfade     linsegr  1, 0.01, 1, 0.33*idelay*(1+ifdbk)*(1+iecho), 0
  aout      =        aout*kfade
  
  xout aout
endop
  </opcode>
</modul>
